Record No.,Inventory No.,Archive Name,Archive Call Number,Archive Type,Date of Appraisal,Owner Last Name,Inv. City,Inv. Count,Inv. Country,Art Value,Inv. Value,Owner Life Dates,Marriage Date,Ceremony,Additional Names,Owner Full Name,Sex,Notary,Occupation,Purpose,Religion,Residence,Biographical Notes,Intro Text
374,473,Gemeentearchief Amsterdam,"569 , fol. 559 and foll.",Notarial,1639/05/06,Hendrix,Amsterdam,35,Nederland,,,1597 |d  ?,1639/04/06,Pui,"last widow of  Roelof Fredericksz. Vos, intended bride of Balthasar van der Veen (painter)","Hendrix, Grietge (Schaeff)",F,L. Lamberti,"Merchant (largescale) |a Wine, brandy (Vos); Artist |a Painter (Van der Veen)",Prenuptial inventory,,Op de Nieuwe Appelmaerckt by de Naybrugh daer lampen uyt hanght in Amsterdam,"Balthasar van der Veen was only about 13 years old when he bought lots in the Haarlem lottery of 1606. He was then living in the Coninck van Vranckrijck in the Warmoesstraet (GAA 73/46 F 583). On 6 April 1639, Balthasar van der Veen, from Amsterdam, painter, 42, assisted by his neve Jan Haes, living on the Kleuveniersgraft, was betrothed to Grietie Hendricks Schaeff, from Emden,  widow of Roeloff Vos, living on the Conincxgracht. She was illiterate (DTB 675/121). Jan Haes, the nephew or cousin of Balthasar van der Veen, was a wine dealer, as was Roeloff Vos. Roeloff Vrericx Vos, wine dealer on the Wisselsluijs, was insinuated along with many other wine dealers on 30 November 1630 (NA 910, film 1146, Not. Pieter Eyloff). Grietie Hendricks is unlikely to  have been the daughter of the Notary Hendrick Schaeff (of INVNO 123) who was first married in 1624. On 23 April 1643, the honorable Balthasar van der Veen, painter, and the honorable Grietge Heyndricks made their testament. They are living on the East side of the Coningsgracht (probably the house where Grietge was living at the time of her marriage). In case of her death, her good friend Joost Bourgongie will be executor in addition to her husband. The provisions of the testament indicated that she had more money than he did (       Oud Holland 12(1894), p. 58). On 1 June 1650, Margriete van der Veen, living in Naarden, drew up a procuration allowing her husband Balthasar van der Veen to collect money due to her in Amersfoort (ibid.) In 1657, he became a member of the Guild of St. Lucas in Haarlem (ibid.) The painter Balthasar van der Veen cannot be identical with the individual of the same name, married to Aeltgen (Alidt) Jaspers Becker, who was said to be the widow of Balthasar van der Veen by 6 July 1644 (DTB 5072/872). Aeltgen Becker was the mother of Aeltgien van der Veen, the wife of Andries Polster of R 23420.","Inventaris ende specificatie van allen de goederen die Grietge Hendrix lest weduwe van Roelof Fredericksz. Vos tegenwoordich hebbende ... Postscript: Compareerde die E. Grietge Hendrix lest weduwe van Roeloff Fredericksz. Vos verclarende ... deuchdelijck inventaris te zijn den 6 Maij 1639, ten overstaen van Balthasar van der Veen hare toecomende man ter presentie van Claes van Zanten ende Jacob Michielsz."
380,479,Gemeentearchief Amsterdam,"NA 927, film 1154",Notarial,1638/07/12,Sturck,Amsterdam,38,Nederland,,,?-1642/02/25,1635/06/28,K,,"Sturck, Niclaes Egbertsz. van der",M,P. Meulenaer,Merchant (largescale),transfer or sale of possessions (?),Reformed,Op de Heere Graft in de Groningen Os in Amsterdam,"Niclaes Egbertsz. van der Sturck was a leather merchant. On 28 July 1634, Cornelis Henricx Rijser, dean, and Henrick Pottey and Claes Egbertsz. Sturck, headmen of the leather dalers, tanners, and shoemakers guild, testified that they had bought for the profit of the guild 700 hides from Willem Stritman living in Zutphen (NA 991, fol. 34, Not. J. Bosch). On 19 September 1632, Niclaes Egbertsz. and Maria Goverts had their daughter Catrina baptized in the N.K. in the presence of Maria Claes (DTB 41/210). On 20 June 1635, the honorable Nicolaes Egbertsz. van der Sturck, widower of Maria Jacobs (Goverts), signed a pre-nuptial contract with Sara Hiole, assisted by her mother Jacqueline le Cocq, Jeronimo Vittori, her brother-in-law, and Isaacq Hiole, her brother (of R 23398)  (NA 988, act 9, Not. J. Bosch).  On 28 June 1635, Nicolaes Egbertsz. van der Sturck, from Amsterdam, merchant, widower of Maaike Govaerts, living on the Keysersgracht, was betrothed to Sara Hiole, from Amsterdam, 22, living on the Heeregracht, assisted by her mother Jacqueline de Cock (DTB 443/390). Sara Hiole was the daughter of Esaias Hiole and of Jacqueline de Cock of INVNO 249, the sister of Isaack Hiole of R 23398 and the sister of Jacqueline Hiole, the wife of Jeronimo Vittori, horticulturist. Sara died before 9 February 1636 when her mother Jacqueline de Cocq, widow of Esaias Hiole, declared that she had been fully paid from the inheritance left by her daughter Sara, married to Nicolaes Egbertsz. Sturck (NA 991, fol.56, Not. J. Bosch).  On 3 January 1637, Nicolaes Egbertsz., widower of Sara Hiole, was betrothed to Anna van Steenbergen (DTB 445/390).  On 20 November 1639, Niclaes Egbertsz. and Anna van Steenberch had their son Willem baptized in the O.K. in the  presence of Sara van de Venne and Aletta van de Venne (DTB 7/228). Sara van de Venne was the wife of Isaack Hiole (Aletta and Baertie were presumably her sisters). Baertie van der Venne, was  married to Willem van Steenberch, a former alderman of Utrecht, cited in the INTRO,  who was presumably the brother of Anna van Steenberch. Niclaes Egbertsz. van der Sturck was buried on 25 February 1642. 10 f. 13 st. were paid on his behalf to the church (DTB 1100v/46). The putative brother of Niclaes Egbertsz. van der Sturck, named Bartholomeus Egbertsz. van der Sturck, had a daughter Cornelia Bartholomeusdr. van der Sturck, born in 1626, who married Coenraad Temminck, merchant in Amsterdam (Elias, Vroedschap van Amsterdam, p.788). Among the books suggesting that Niclaes Egbertsz. was Reformed: Wtlegginge over de 12 artikulen des christlijcke geloofs, Synod van Dordrecht, a testament, etc.. Another inventory of the movable goods of Nicolaes Egbertsz. van der Sturck (INVNO 4790)  was taken on 21 July 1638, which overlaps in major part with the present inventory (NA 696A, film 4982, Not. Jan Warnaerts).","Inventaris van de goederen van Niclaes Egbertsz. van der Sturck geinventariseert ten versoecke van de eerbare Baertje van de Venne weduwe van wijlen Willem van Steenberch in sijn leven schepen tot Utrecht ... ende transport hebbende van Niclaes Egbertsz. van Sturck ... Postscript: Gedaen t Amsterdam, op de Heere Graft in de Groningen Os ter presentie van Pieter Molenaer, Cornelis Gerbrantsz. Root ende Albert Hendricxen clercken als getuijgen hiertoe versocht opten 12 julij anno 1638."
381,480,Gemeentearchief Amsterdam,"863, film 579",Notarial,1634/11/10,Wijn,Amsterdam,14,Nederland,128 |d ,694 |d ,,,,goods transferred to Adriaen Jansz. Pleecker and Andries Andriessen,"Wijn, Reynier Jansz. van",M,Jacob van Zwieten,,transfer or sale of movable goods as collateral to secure a debt for cloth amounting to 859 f.,,Amsterdam,"Andries Andriessen may be identical with the merchant of R 20031 who went by the name of Andries Andriessen or, more rarely, Adriaen Andriessen.","Inventarisatie ende specificatie van de goederen toebehoort hebbende Reynier Jansz. van Wijn, wonende te Leiden, ... ... tegenwoordich met de geanexeerde transport getransporteert aen Adriaen Jansz. Pleecker ende Andries Andriessen... Postscript: Aldus gedaen ende gepriseert  ... den x november 1634."
382,481,Gemeentearchief Amsterdam,"NA 409, film 4783, fol. 476",Notarial,1638,Plouijs,Amsterdam,11,Nederland,93 |d ,1036 |d  17 stuivers,,,,and his widow Janneken du Paeme,"Plouijs, Anthony du",B,Jacob Jacobsz.,"Manufacturer |a Dyer, wax bleacher",death inventory,,Amsterdam,"This inventory may be incomplete, since the only paintings noted were found in the bovencamer, but they may of course have been gathered there for purpose of inventarization. An earlier inventory of the estate of Anthony du Plouijs, dyer, had been taken on 6 November 1634, which included all his dyer's equipment. According to this earlier inventory, du Plouijs owned houses, one on the Kloveniersburgwal, one on the Binnen Amstel and one on Huivettersgracht (Van Dillen, Bronnen tot de geschiedenis van het bedrijfsleven, R.G.P., 144(1974), p. 74).   On 30 November 1627, Antonij Ploijs and Jannetje de Pau had their son Antonij baptized in the N.K. (DTB 40/426). On 14 August 1629, Antonii du Plochnij (sic) and Janneken de Pau had their daughter  Janneken baptized in the N.K. (DTB 41/36). On 7 October 1630, Hans Thijsz. ceded to Anthony Duplowy, blue dyer, various yarn-spinning equipment against a debt he owed him (Van Dillen, op. cit. R.G.P., 78(1933), p. 732).  On 26 September 1631, Anthonij Plouij and Janneken de Pauw had a second Jannetie baptized in the O.K. in the presence of Janneken Mathijs DTB 6/348). On 31 December 1635, the eerbare Juffr. Aeltgen Henricx, widow of the heer burgomaster Cromhout, on one side, and Janneken de Paeuw, widow of Anthonij du Plouijs, presently the wife of Cornelis Jacobsz., assisted by the latter, together with Gillis Vertangen (of INVNO 241) and Jacob Jacobsz., likewise Notary Public, solicited during his life time  by the above-name Anthony du Plouis and authorized to liquidate his estate, on the other, reached an accord concerning the accounting of the assets and liabilities of the estate. Among the assets, considerable quantities of indigo and cochinella, cotton and linen fabrics, and 8,000 f. in alderman's obligations (schepenkennissen). Abraham van der Sluijs (of R 20029 of Montias2) signed as a witness (NA 412B, fol. 463, Not. Jacob and Nicolaes Jacobsz.) Pieter du Ploijs, cited in the INTRO, was Anthonij du Plouijs's brother. Anthony du Plouijs was presumably related to Gillis du Plouijs of R 20715 of Montias2.","Inventarisatie gedaen by my Jacob Jacobsz. notaris ... ten versoecke van Janneken du Paeme weduwe van Anthony du Plouijs in syn leven verwer binnen dese stede, ten overstaen van Pieter du Plouijs, oom vande nagelatene kinderen van de selve Anthony du Plouijs by d' gemelte Janneke du Paeme geprocreert, van alle de meubele huysraet ende imboedel mitsgaders cleden lynen ende wollen inde voors. sterfhuyse bevonden, synde d selve ... by Aeltgen Claes ende Annetgen Henrix gesworene schatsers geschat ..."
383,482,Gemeentearchief Amsterdam,"1052, fol. 100 and foll, film 1263",Notarial,1639/01/17,Hoochcamer,Amsterdam,62,Nederland,,,1601 |d ?,1624/08/06; 1639/08/?,,"goods transferred to Joan Ingels, advocaet","Hoochcamer, Henrick",M,J. van Ven,"Merchant (largescale) |a Cloth, silk; Employee |a Admiralty, V.O.C., W.I.C.",transfer of goods as collateral for surety on loan,,In de Warmoesstraet in  Amsterdam,"Hendrick Hooghkamer, born in 1601, was the son of Jan Pietersz. Hooghkamer and Ida Hendricks Cort. Jan Pietersz., silk cloth dealer, was a member of the Raad of Amsterdam from 1618 to 1638, in which latter year he went bankrupt. Hendrick Hooghkamer was also a silk cloth dealer in the Warmoesstraet. He was only about 21 years old on 25 August 1622 when he signed an agreement, together with 20 other Lyeffhebbers der Nederduytsche Poesy, to provide subsidies to the poet Jan Jansz. Starter (Oud Holland 3(1885), p. 54). He was equipage master of the Admiralty in Amsterdam in 1637 and 1638 (at the time the present inventory was taken). He married Maria de Vogelaer on 6 August 1624. Baptized on 2 July 1606, she was the daughter of Marcus de Vogelaer and of Margaretha van Valckenburgh (of R 23422 of Montias2). She was buried on 23 January 1638. Hooghkamer remarried in Utrecht in August 1639 with Jannetgen Brouwer, widow of Wouter de Leeuw (Elias, Vroedschap, p. 323). Hendrick Hoochcamer, living in the Warmoesstraet, paid a tax  f 120 f. in 1631 (Kohier, fol. 208vo, p. 48). On the attorney Jan Ingels (or Engels), see the NOTES to  R 7620 of Montias2. Joan (or Johannes) de Vogelaer was the brother of Maria de Vogelaer, the wife of Hooghkamer. He had apparently borrowed 6,000 f. from the attorney Jan Ingels, which loan had been guaranteed by Hooghkamer. Joan de Vogelaer must have defaulted on the loan, which Hooghkamer was now responsible for repaying. He had pledged his movable goods plus his salary as Equipage Master of the Admiralty  to Jan Ingels to this end. He may have become insolvent as a result, which would explain his removal to Utrecht for his second marriage. On Joan de Vogelaer's activities as a trader with Russia, see Wijnroks, Handel tussen Rusland en de Nederlanden, 1560-1640, p. 286. On 17 January 1650, Hendrick Hoochcamer signed an agreement with 25 other creditors of Cornelis van Bruegel (cited in the NOTES of R 35467 of Montias) in reduction of his debts. His name in the list of creditors stood just above that of Laurentje Brouwers, who is likely to be one of his second  wife's relatives (DBK 5072/872).","Compareerde d' heer Henrick Hoochcamer Equipagemeester van de E. Collegie ter Admiraliteijt deser voors. stede ... ende verclarde vrywillich ... getransporteert ende opgedracht te hebben ..... ten behoeve van Joan Ingels advocaet binnen deser stede ... alle ... soodanige meubelen huysraet, Imboel, gout ende silver mitsgaders andere goederen als hierachter gespecificeert ende genomineert  ... dit alles in rekeninge, bevrijdinge, Indemniteyt ... ende ontlasting van alsulck borchtochte .... obligatie als de voors. Mr. Jan Engels voor hem cedert [heeft]  aen ende ten behoeve van Sr. Joannes de Vogelaer dato dese ... van de somme van ses duijsent carolus gulden ... Heeft hy ... mede ten behoeve van de voors. Mr. Jan Ingels getransporteert ende gecedeert ... syn andere meerdere goederen, actien, schilderyen ... mitsgaders gagie, tractementen alrede by de heeren ter Admiraliteyt .... verschenen .... Aldus gedaen binnen deser voors. stadt ter presentie van Pieter Lodesteijn ende Joannis de Wit den 17 Januaris 1639.  Volgt 't lyst ende specificatie van de ... getransporteerte goederen."
384,483,Gemeentearchief Amsterdam,"NA 676, film 4979",Notarial,1630/04/29,Peenen,Amsterdam,39,Nederland,,,,1625/10/18,Pui,,"Peenen, Lucas van",M,J. Warnaertsz.,,The fact that curators had been appointed to supervise this inventory suggests that Lucas van Peenen may have been bankrupt.,,Op de Oostsyde van de Keysersgracht in Amsterdam,"Lucas van Peenen, a merchant of South Netherlandish origin, was first noted in Amsterdam in 1622 (Gelderblom, Zuid-Nederlandse kooplieden p. 310). On 18 October 1625, Luijcas (signs Lucas) van Peene, 33 years old living in the Verwerijen, assisted by his brother-in-law Pieter Jolijt, was betrothed to Catharina van Peen, living in Middelburgh (DTB 763/151). On Pieter Jolijt, ironmonger, see the NOTES to R 20007 of Montias2.  On 9 May 1628, Luijcas van Peene and Catrijne van Peene had their son Pieter baptized in the N.K. in the presence of Pieter van Peene (DTB 40/451). Note that Melchior van Hoorn, of R 20007 of Montias2, married Susanna Jolijt Pieters, who seems to have been the daughter of the swager of Lucas van Peene. Their daughter Cornelia married Isaack van Peenen, who may have been the son of Lucas van Peene (see the INTRO to INVNO 395 in R 21 of Montias1).",Inventaris van den goederen meublen ende anders bevonden ten huijse van Lucas van Peenen gestaen op de Oostsyde van de Keysersgracht Postscript: Gedaen ... 25-29 Aprilis anno 1630 ten versoecke van Nicholas de Cocque ende Pieter de Bitter als curateurs van den voors. Lucas van Peene.
385,484,Gemeentearchief Amsterdam,"448, film 4808",Notarial,1634/04/06,Heem,Amsterdam,17,Nederland,1130 |d ,,,,,goods transferred to Otto Roeloffs Walsburch,"Heem, Fransoijs de",M,Palm Mathijs,Merchant (largescale) (De Heem),sale of goods in compensation for debt,,Op de hoeck van de Visscher straet binnen Amsterdam,"Francoijs de Heem was a merchant. He transferred the goods in this inventory to Otto Roeloffs Walsburch as collateral for a debt of 2,200 f. that he owed Walsburch.","Op huijden den sesten April xvi vier ende dartich compareerde voor mij Palm Mathijs notaris .... Fransoijs de Heem coopman wonende op de hoeck vande Visscher straet binnen deser stede ende heeft in titule van coop opgedragen, gecedeert ende getransporteert ... aen ende ten behouve van d 'Eersame Otto Roeleofs Walsburch burger deser stede alle de goederen hiernae gespecificeert.  Postscript: ...Dit alles in affkortinge ende betalinge van allsulcke twee en twintich hondert gulden als de voors. Otto Roeloffsen van hem comparant is competerende.  Gedaen binnen der voors. stede ten huijse ende herberge uithangende de Beurse van Amsterdam achter de Beurse ten bijwesen van Christiaen Breeckbalck gesworen maeckelaer, Gerbrant Warnaersz. als getuijgen ..."
386,4090,Gemeentearchief Amsterdam,"593, film 4938",Notarial,1631/04/10,Well,Amsterdam,40,Nederland,,,,1601/07/21; 1631/02/13,,and her husband Adriaen Jacobsz. van Noort,"Well, Elisabeth van der",B,L. Lamberti,,goods brought to marriage according to marriage contract,Reformed,Op de Heregracht in Amsterdam,"Elisabeth van der Well (Wel) was formerly married to Jan Pietersz. du Bien (of R 30035),  who was buried on 15 February 1639. She was betrothed to Jan Pietersz. du Bien on 21 July 1601 (see the NOTES to R 30035 of Montias2).  Some of the paintings she brought to her marriage with Adriaen Jacobsz. van Noort may have come from her previous marriage. This inventory in part overlaps with INVNO 409, the inventory of the possessions of Elisabeth van der Wel and Adriaen Jacobsz. van Noort taken on 8 January 1639. The works of art that the two inventories have in common are indicated in the present inventory.","Inventaris ende specificatie van allen den huijsraet Imboel schilderijen ende silverwerck bij Joffr. Elisabeth van der Well in huwelijck gebracht aen de E. Adriaen Jacobsz. van Noort hare tegenwordige man, gemaeckt by mij Laurens Lamberti notaris ... ten versoecke van de voors. Jufr. van der Well. Postscript: Aldus geinventariseert ende gespecificeert in Amsterdam ten huijs van de voors. Elisabeth van der Well op de Heregraft desen 10en April anno 1631 ... welck. volgende bekenne ick Adriaen Jacobsz. dat de voors. Elisabeth van der Wel de voors. huysrade Imboelen schilderyen ende siverwerck by mij gebracht heeft."
387,486,Gemeentearchief Amsterdam,"992, film 4941",Notarial,1639/06/30,Solt,Amsterdam,21,Nederland,830 |d 10 stuivers,1533 |d  6 stuivers,,,,,"Solt, Hans van (II)",M,Jan Bosch,,sale and collateral for loan,,Op de Princegracht in Amsterdam,"Hans van Solt de jonge, the son of Hans van Solt de oude of R 29281 of Montias2, was born in Antwerp. He married Maria de Wolf in 1607. After her death, he was again betrothed, on 30 January 1626, to Agatha van Marel (or Maerle, signs Merlen), 23 years old, assisted by her father Hans van Marel (of INVNO 270), and her sister Maria van Marel (DTB 431/26). In 1631, he was living on the Groene Burchwal when he was taxed 90 f. (Kohier, fol. 224, p. 90). For further details, see R 21567 of Montias2.","Compareerde voor mij Jan Bosch notaris Sr. Hans van Solt mij bekent verclarende dat hij aen Jouffr. Maria van Maerle zijn huijsvrouwen suster vercoft hadde de naervolgende stucken schilderijen, met diversche stucken porceleijn, een armosijn spree ende ses violetten letter houten stoele ten prijs als jeder hier naer uijtgedruckt staet, namentlijck [.... see INVNO 486 in Montias2] ... mitsgaders een stuck schilderije, met een vergulde lijst gedaen bij Nieul[and]t genaemt wordende Antiqua, ende twee stuckgens schilderije uijt Ovido met swarte vergulde lijsten zijnde 't eene een papeeter ende 't ander Pomona welcke drie stuckgen schilderijen noch zijn ten huijse van hem comparant ende in zijn bewaringe, die hij op haer [Maria van Maerles] vermaninge aenneemt ende belooft haer mede in handen te zullen stellen ende welcke voors. geoppegnorende parcelen sijns comparant kinderen geprocreert bij Jouffr. Agata van Meerle zijn huijsvrouwe in eijgendom toecomen, als zijnde ten dele den voors. Jan van Meerle zijn voors. huijsvrouws vader was ende ten dele bij de selve zijne huijsvrouw met hare eigene potpenningen met wille ende toestan van hem comparant voor ende ten behoeve van de selve kinderen gecoft.... Compareerde voor mij notaris Maria van Meerle zijnde geaccompagneert met Sr. Oto van Langen haer man ende voogt ende bekende tot verseeckeringe van haer achterwesen aen de voors. haren swager ... ter somme van f 442:18:-- de voors. gespecificeert goederen van hem ontfangen te hebben .... Gedaen .. ten huijse van de voors. van Solt staende op de Princegracht op den lesten junij anno 1639 int bijwesen van Gerrit Maes ende Gysbert Sweers mijn clerquen."
388,487,Gemeentearchief Amsterdam,"860 , fol. 124v and foll. , film 577",Notarial,1631/05/26,Winijus (Winius),Amsterdam,53,Nederland,,,1605/03/08 |d  ?,1628/02/27,,,"Winijus (Winius), Andries Dionijs",M,Jacob van Zwieten,Merchant (largescale),"Furniture transferred to the owner's father, apparently in anticipation of his [Andries's] forthcoming journey to Russia.",Reformed,Amsterdam,"Andries Denijsz. Winius was baptized in Amsterdam on 8 March 1605, the son of the tailor Dionysius Tjercksz. and of Maritgen Andriesdr. Vekemans.  On 27 February 1628, he was betrothed to Geertruyd van Rijn (born in 1611), daughter of Willem Jacobsz. van Rijn (of R 31254)  and Trijntge Dircks. On 11 June 1636, Cornelis Jochums, 24, and Claes Adamsz., 25, declared at the request of Dionys Tiercx, father of Andries Winius, that the aforesaid Andries Dionys Winius had gone to Moscow in the year 1634 with his wife and his whole household in order to live there. He had taken all his possessions with him, only leaving his house, standing on the corner of the Kerckhoff or Oude Appelmarckt, that had come from the late Geert Lambrecht, who had been the grandmother (bestemoeder) of Andries Dionys's wife (Economisch-Historisch Jaarboek 2(1916), p. 276). In Moscow, Winius was a merchant and Commissary of His Majesty the Tsar of Moscovy. In 1632, Andries Winius, Thomas de Swaenn and Peter Marcelis (brother of Gabriel and Celio Marcellis) were granted a concession for setting up an iron works in the rich iron district of Tula, south of Moscow (Van Dillen, Van rijkdom en regenten, p. 319).  On 27 July 1654, a dispute is said to have risen between Winius, as Commissary of the Tsar, and sr. Jacob de Lange, merchant in Amsterdam, concerning the delivery of two cases of weapons containing 50 carabins each. Lange claimed that he had delivered them to Hans Marssou in Moscow, which Marssou denied. There were also discrepancies in other shipments (Van Dillen, Bronnen tot de geschiedenis van het bedrijfsleven R.G.P. 144(1974), pp.624-5). On Winius, see also Wijnroks, Handel tussen Rusland en de Nederlanden 1560-1640, passim.  On 19 November 1636, Jacques Bygoet was bound and apprenticed to Dionysius Tircx on behalf of his son Andries Winnius, merchant, for 2 years, to serve in Moscovy. Bijgoet was to make fire arms (vuyrroersloopen), locks and drawers. Bijgoet was to be paid 400 f. a year. (NA 521, film 4861, Not. Westfrisius). Portraits of Andries Denijsz. Winius and Geertruyd van Rijn by Isaack Luttichuys, thought to date about 1654, were with a Brussels dealer in 1954 (Prijst de Lijst, Exh. Catalogue, Rijsmuseum, 1984, p. 168 (illustrated)).",Inventaris van de meubelen huysraet ende inboel toebehoort hebbende mij Andries Dionijs Winijus coopman binnen deser stede ende tegenwoordich getransporteert aen Dionijs Tjerkx mynen vader [die] ... consenteert dat ick de voors. meubelen in precario en tot wedersegens toe besetten ende gebruijcken ... Postscript:  Aldus geinventariseert bij mij Andries Dionijs Winijus ... den xxvi meij anno 1631.
389,488,Gemeentearchief Amsterdam,"919, film no. 1150",Notarial,1637/07/03,Jans,Amsterdam,11,Nederland,35 |d  10 stuivers,808 |d  9 stuivers,,,,late wife of Harmen Luijcasz.,"Jans, Giertje",F,J. Verbeecq,"Food preparation |a Baker, pastry cook",death inventory,,In de Niesel in Amsterdam,"On 6 January 1615, Herman Luijcasz. and Giertie Hermans had their son Luijcasz. baptized in the N.K. (DTB 39/371). Giertie Jans may be a clerk's error or a misreading of Giertie Hermans. Herman Luijcasz. was one of the supervisors of the estate of the baker Gerrit Jansz. Kock (INVNO 343 of 27 August 1655). The house on the Niesel where Herman Luijcasz. lived and died was estimated 2,400 f. in his inventory.","Inventaris van de goederen die Giertje Jans metter doot ontruijmt ... heeft, geinventariseert ende getaxeert door Aeltje Claes ende Annetge Hendricks gesworen schatsers ten versoecke van Harmen Luijcasz. backer weduwenaer van de voors. Giertje Jans ... Postscript: Aldus gedaen ... ten huijse van de voorn. Harmen Luijcasen staende inde Niesel ter presentie van Jan Hooglant and Pieter Meulenaer ... opten derden Julius 1637."
