Record No.,Inventory No.,Archive Name,Archive Call Number,Archive Type,Date of Appraisal,Owner Last Name,Inv. City,Inv. Count,Inv. Country,Art Value,Inv. Value,Owner Life Dates,Marriage Date,Ceremony,Additional Names,Owner Full Name,Sex,Notary,Occupation,Purpose,Religion,Residence,Biographical Notes,Intro Text
213,297,Gemeentearchief Amsterdam,563 B,,1636/12/16,Coleur,Amsterdam,20,Nederland,,,1589 |d 1633,1612/09/01,K,and his wife Belytge Barens,"Coleur, Anthoni",B,J. Westfrisius,Services |a School teacher,death inventory,Calvinist,Amsterdam,"Anthony Colleur or Couleur was said to be a schoolmaster, 23 years old, when, on 1 September 1612, living on the Western Corenmarckt, he was betrothed to Pietertge Ghysbertsdr., 22, assisted by her mother Machtelt Jans (DTB 416/251).  On 15 October, Anthony Couleur, widower of Pietertge Gijsberts, was betrothed to Belitje Barents, assisted by her father Barent Gerritsz. Brincker (DTB 431/438). After his first wife died, a dispute arose concerning the inheritance of the children, who ranged in age from 9 to 3/4 years, on 6 January 1626 (WK 5073/789). He was probably Reformed, as the books in his inventory, (works of William Perkins, Calvin, Theodore Besa, etc..) attest. He died in 1633. He was also a buyer at WK auction (for additional bio details, see the NOTES to R 22170). For additional information on Anthony Couleur, schoolmaster, see the NOTES to R 22170 of Montias2. The guardians over the children, the box or coffin maker Egbert Gerritsz. and Harmen Jacobsz. Karreman have not been identified.","Staet en inventaris van de boedel ende goederen van wijlen Anthoni Coleur ende Belytge Barens geweesene echteluyden gel. die selve staende huwelick met melckanderen gepossideert hebben ende by het overlyden van de voorn. Anthoni Coleur bevonden syn. Beschreven by mij notaris .... ten versoecke van de voorn. weduwe, item Egbert Gerritsz. kistemacker ende Harmen Jacobsz. Karreman als voochden van de voorn. weduwe mitsgaders Dirck Grijp by de heeren weesmeesteren daer bij gevoecht ten behoeve van de onmondige kinderen van den overleden, synde de selve bevonden als volcht. Postscript: Aldus geinventariseert  ... den xvi Decembris 1636."
214,298,,NA 564A,Notarial,1638/11/05,Jans,Amsterdam,26,Nederland,,,1583 |d 1638/11/02  |n Jans; 1577 |d c. 1635  |n Persoij,1603/11/15,K,widow of Michiel Perseijn (Persoij),"Jans, Judith",F,J. Westfrisius,"Food preparation |a Baker, pastry cook",death inventory,Calvinist,Amsterdam,"On 15 November 1603, Michiel Persijn (signs Persoij), from Parijs, kock (cook),  26 years old, living on the O.Z. Voorburgwal, was betrothed to Judith Jans, 20, living there also. She was illiterate (DTB 411/376). On 9 November 1604, Michel Persoij and Judith Jans had their daughter Francijn baptized in the N.K. in the presence of Hester Jans (DTB 39/51). On 27 November 1615, Michel Persoij and Judith Watus had their son Michiel baptized in the French Church in the presence of Isaac Punile and Jenne de Morge (DTB 130/18). On 26 January 1620, Michel Persoij and Judith Persoij had their daughter Marije baptized in the French Church  in the presence of Jerosme (Jeronimo)  Hostier and Caterine Giart (DTB 130/97). On 13 March 1636, Judit Jans, widow of Michiel Persoy, cook, declared at the request of Griet Jans, that she had given Elsgen Jans, the mother of Griet Jans, 25 f. for a year's rent (NA 911, Not. Eyloff). On 11 September 1637, Judith Persoij, widow of Michiel Persoy and Harmen Hendricksz., tailor, signed a contract of appreticeship (as a cook) for Harmen's son Jan for 5 years in her shop. No money was paid for the apprenticeship (NA 1185, fol. 133, Not. J. de Vos). Judith Persoij was  buried in the F.K. on 2 November 1638 (DTB 1130/77). Pelgrum van Hooft, who was said to be the grandfather of Sara and Pietie Perseijn (perhaps the children from a first marriage of Michiel Perseijn), was a buyer at auction (R 20353 of Montias2).  Michiel Persoij II, baptized in 1615, was betrothed to  Elisabeth van Diemen, daughter of Jochem van Dien (or Diemen), of R 23405 of Montias2, on 27 October 1644 (DTB 461/162). Pieter Persoy, master cook, who took on an apprentice on 2 May 1634, was probably the child Pieter cited in the INTRO (Van Dillen, Bronnen tot de geschiedenis van het bedrijfsleven R.G.P. 144(1974), p. 52). Jannetje Persoij, the daughter of Michiel and Judith Persoij, signed a pre-nuptial contract with Pieter Danielsz. Plantius (assisted by his grandfather Carel Lenartsz. I, probably of INVNO 640 and by her uncle Hendrick van Rossum) on 18 January 1634. She was assisted by her mother Judith Persoij and her swager Philip Bartelsz. (probably the son of Bartelt Philipsz. of R 27378). In case the bridegroom were to die first, the bride-to-be was slated to receive 600 f. (NA 911, film 1147, Not. Pr. Lodewycx). On 8 December 1648, the honorable Jan Jansz. Somer and Lambert Lucas Raningh declared that Job Teunis and Hans Meus had guaranteed the disbursement of  a sum of 800 f. that Laurens Meus, caffawercker in Amsterdam, had received from the hands of Nicolaes Cocques (of R 20336 of Montias2), pursuant to a sentence of the aldermen, which sum was coming from Judith Jans, widow of Michel Persoij (NA 1599, fol. 55, Not. Willem Hasen). Among the books in the present inventory: Expositie Calvini, Sleydanus, and Het loff des kerckes. These books suggest that Michiel Persoij I was Reformed (Calvinist).","Staet ende inventaris van den boedel goederen van wylen Judith Jans weduwe van Michiel Perseijn gelijck  sij de selve metter doot ontruijmt heeft ende naer haer overlyden bevonden is, beschreven door mij notaris ... ter requisitie van Mr. Nicolaes Coccus ende Aert de Haes als executeurs van de testamente van de voors. Judith Jans ten overstaen van Pieter, Michiel, Franzyntje ende Janneken Perseyn tsamen kinderen van den overleden mitsgaders Marten Bardewigh end Pelegrim van Hooft respective vader ende grootvader van wylen Sara ende Pietie Perseijn, synde als volcht."
215,299,Gemeentearchief Amsterdam,563 A,,1634/09/09,Tiason,Amsterdam,20,Nederland,,,1590 |d aft. 1636,1615/08/08,Pui,,"Tiason, Albert",M,J. Westfrisius,Merchant (largescale); Manufacturer |a Paper,execution of court sentence (presumably on behalf of creditors),probably Mennonite,aende Keysersgracht in Amsterdam,"On 8 August 1615, Albert Tiason, 25 years old, living on the Warmoesstraet, no living parents, was betrothed to Paschina van der Straten (signs), from Guelich, 38, living in the Halberstraet, no living parents (DTB 667/199). It was perhaps his father of the same name who, in 1595, together with Cornelis van Lockhorst, Ludwig Koenig (in Basel), and Dietrich Krassert (in Strassburgh), had formed a paper-making company in Amsterdam, although the actual paper was produced in Basel (Th. Laurentius, Paper in the Netherlands in Fresh Woods and Pastures New: Seventeenth-century Dutch Landscape Drawings from the Peck Collection, Exh. Cat. Un. of North Carolina, Chapel Hill, N.C., p. 30.) Cornelis van Lockhorst, the principal partner, known as pampierverkoper (see the NOTES to R 25092), died in 1617. On 24 May 1631, Albert Jason, merchant in Amsterdam, appeared before the aldermen of Monster (near Delft). He refused, by reason of conscience, to give an oath (RA Monster 103, # 338, kindly communicated by Gerard van Eendenburg). He may therefore have been a Mennonite.  On 7 January 1634, Albert Tjason was insinuated by Roelandt van der Perre (perhaps the brother of Balthasar van der Perre (of R 8218 of Montias2). Roelandt van der Perre was administrator of the Compagnie der Duijtsche pampieren (NA 409, film 487, Not. Jacob and Nicolaes Jacobsz.) This insinuation may be related to the insolvency that led to the making of the present inventory. This insolvency may also be related to a suit waged by the widow and the heirs of Philips van Kazele against Tiason. P.C. Hooft intervened with the Eerste Raedt in the Hooghen Raede, on behalf of the widow (letter to Rochus van der Honart, Briefwisseling van Pieter Corneliszoon Hooft, vol. 2, p. 529). On 16 July 1636, Albert Tjason, as husband and guardian of Paschina van den Straten, together with Anna van den Strate, spinster, and Franchoys van der Strate, for themselves and as holders of a procuration from their mother Maycken Jans van Noucken(?), all heirs of their brother David van der Straten, went to the house of Samuel Sautijn, where Juffr. Sara Munnincx, widow and holder of the estate of Jan van der Straten (of R 27080) was living,  and, in her absence, insinuated her son, also named Jan van der Straten,  as follows. Sara Munnincx should procure an inventory of the goods left by David van der Straten (left with Jan van der Straten I), along with the accounts and other papers pertaining to David van der Straten's estate. Jan van der Straten II said he acknowledged the insinuation on his mother's behalf and asked for a copy of it (NA 889, film 595). Samuel Sautijn was a very rich merchant who traded in the Levant. On 20 June 1602, he married Maria van der Straten, daughter of Jan Fransz. van der Straten (of R 27080) and of Sara Monx (Munnincx), cited above. Montias2.    Among the books in the inventory: Drie bijbels gebonden, een Docta synodis nationalis, Het nieuw testament in grieks.","Inventaris van de goederen toebehorende Albert Tiason beschreven door mij Jacob Westfrisius ... ten huyse vande selve Tiason gestaen hebbende aende Keysersgracht, op requisitie van Cornelis Molenijser deurwaerder van den Hove [Holland] uijten naeme ende van wegen Philips van Caseel, uijt crachte van letteren executoriael gedeponeert op een provisionaeel sententie bejde van den Hove ende Hoge Rade in Hollandt, ten overstaen van den here officier Jan ten Grotenhuijsen, Jacob Jacobsz. Vinck, ende Wouter Valckenier, beijde schepenen ende raden deser stadt ende sijn de selve ter plaetse voors. bevonden als volcht. Postscript: Aldus geinventariseert ten overstaen van mijn heeren de officier ende Jan Grotenhuijsen op ten  9-en Septembris 1634"
216,300,Gemeentearchief Amsterdam,563 A,,1632/05/27,Marees,Amsterdam,62,Nederland,1377 |d ,,?  |d  1631/11/12,1627/02/16,K,,"Marees, Abraham de, den Oude",M,J. Westfrisius,Merchant (largescale),death inventory,probably Calvinist,Amsterdam,"Among the books: Synod van Dordrecht,Uijtlegging Calvini. There were  many items of copper ware in the warehouse, including a large croon (multi-branch candelaber)  evaluated  at 30 f, a small one at 4 f, chandeliers etc..  Two inventories were drawn up of Abraham de Marees's possessions, the first, without evaluations, on 23 November 1631, the second , with prices, on 27 May 1632. The paintings in this second inventory were assessed by Francois Venant (I)  who was said to be overman van't schildersgilde. The records in Montias2 are based chiefly on the second inventory with some additions from the first, as noted. Abraham de Marez I, son of Jan de Marez I (1517-1603), initially passementwercker (lace worker),  then merchant in silk goods, married Maria Gemaert, daughter of Jean Gemaert and Maria Sturms, on 16 February 1627 (Jaarboek C.B.G. 44(1990)). The following insinuation, dated 9 July 1625, refers to the time when he was dealing in silk goods. Jan Baptista de Wael, insinuant, summoned Abraham de Marees to pay for eight bales of raw Moscow silk, which he had bought together with Coenradt de Wilde (II) (Van Dillen, Bronnen tot de geschiedenis van het bedrijfsleven R.G.P. 78(1933), pp. 576-7). He died on 12 November 1631. He lived in an expensive house in the Warmoesstraet, near the Lange Kercksteech (NA 563A). Abram's brother Daniel de Marez married Jenne Hurter (born in Middelburg about 1573), on 30 June 1595. His nephew, Jan Danielsz. de Marez, son of the preceding, married Christina Segers, the daughter of Jasper Segers of R 20521, and, after her death, Elisabeth de Schilder, daughter of Pieter de Schilder (of R 27188) and of Elisabeth Cobbaut (daughter of Aernout Cobbaut II of R 21250). Jan de Marees Danielsz., merchant, was said to be 40 years old in a deposition he made at the request of Jonas Abeels (cited in the TEXT of R 79)  concerning a ship on 16 November 1637 (NA 695B, Not. J. Warnaerts).   His other brother Nicolaes de Marees was the putative father of Sara de Marees I of INVNO 1207. Abraham de Marez II, the son of Abraham de Marez I, was a merchant on the Nieuwendijk. He married, first, Sara de Coster, and then, on 5 June 1626, Rebecca Hooghkamer. He drew up his testament on 18 July 1635, leaving 64,000 f. to his three children with his first wife Sara (de) Coster and 36,000 f. to his three children with Rebecca Hoochcamer. The six children were named universal heirs (for the rest). Jan (Abrahamsz.) de Marees was guardian of the children of the first bed, Jacob Pietersz. Hoochcamer of the children of the second bed. Jacob Hoochcamer was the testator's father-in-law, the father of Rebecca  (NA 21, film 41, fol. 21 vo., Notary Salomon Henrix).  He died soon afterwards. He paid a tax of 800 f. in 1631 and left an estate of f. 334,000. His son Abraham de Marez III appeared on 26 October 1635 and brought 80,000 f. for the children of Abraham de Marez II from his two marriages (WK 5073/789). On 6 June 1637, the honorable Catharina de Marees (II), as mother and unique heiress of Catharina de Marees (I) and, ab intestato, of Maria de Marees (I), both being her children procreated by Isaack de Marees Abrahamsz., her former husband, assisted by Thomas van Roeye, her present husband, on one side, the honorable Johannes de Marees Abrahamsz., for himself; Pieter de Bary, as husband and guardian of Sara de Marees, his wife, together with Mathijs Hals (of INVNO 411),  as husband and guardian of Marija de Marees (II), Sara de Barij, children of majority age of the afore-said Sara de Marees; Daniel Mits I, the father of Samuel Mits of INVNO 1213, as husband and guardian of Marija de Marees (II), with his wife; Pieter Benoijt, as husband and guardian of Anna de Marees, with his wife; Tieleman van Beringen, as husband and guardian of Elisabeth de Marees, with his wife; Anthoni Verspreet as having married Catharina de Marees (II), who was the widow of Jan Wijs, with his wife; Jan de Barij and the afore-said Johannes de Marees and Tielman van Beringen, together testamentary guardians of the children of minor age of the afore-said Sara de Marees, as also the same Jan de Marees and heer Jacob Pietersen Hoochkamer, member of the Vroedschap and former alderman, as respective guardians over the children of minor age of the late Abraham de Marees de jonge, all in their quality as children and grandchildren of Abraham de Marees de oude and of Maria Gemaert, on the other ... all declared that, in order to avoid a suit, they had come to an amicable agreement regarding the sale of the house on the Warmoestraet (NA 521, Not. Westfrisius). Abraham de Marez I's children included Abraham de Marez II, cited above; Johannes Abrahamsz. de Marees; Anna de Marees, married to Pieter Benoijt; Isaack Abrahamsz. de Marees, married to Catharina de Marees, who remarried with Thomas de Roeye after Isaack's death; Elisabeth de Marees, married to Thielman van Beringen (apparently after the death of Maria van Vickervoort);   and Sara de Marees (II), married to Pieter de Bary (NA 522, film 4861, 6 June 1637). On 14 January 1641, the heirs of Abraham de Marees de oude and of Maria Gemaert offered for sale the house de gecroonde Swaen on 113 Warmoesstraet. The conditions of the sale specified that the present renter of the house could take various additions that he had made to the house and a painting of the Schans of St. Andries. The buyer for 29,200 f. was Jan de Bary (the son of Pieter de Bary and Sara de Marees). The sureties were Abraham Fauconnier (cited in the NOTES to R 23490 of Montias2) and Johannes de la Ville. The heirs were Jan de Mareez Abrahamsz., for himself and as guardian over the (minor) children of the late Abraham de Marees de jonge (II?); Abraham (III?) and Pieter de Marees, already of major age; Daniel Mits de jonge (II),  with a procuration from his father Daniel Mits (I), who was married to Maria de Marees (II); Thielman van Beringen, as the husband of Elisabeth de Marees (see the TEXT of R 38)  and as guardian of Mary de Bary; Mathijs Hals, married to Marie de Bary; Adriaen ter Haer (of R 18942), married to Sara de Bary; and [...] ter Haer, in the name of Susanna de Bary, these five persons being children of Sara de Marees; besides Anthony Verspreet (of R 25596), married to Catharina de Marees, all eight (Jan, Abraham de jonge (III), Pieter, Maria, Elisabeth, Sara and Catharina) children of Abraham de Marees de oude, entitled to an eighth part [of the house] sold 7/8 of the house to Jan de Bary, who was himself entitled to 1/8 as the son of Pieter de Bary, the son-in-law of Abraham de Marees II (J.G. Kam, Waar was dat huis in de Warmoesstraat?, 36/2). Abraham Fauconnier, cited above, was an apothecary. He guaranteed a loan for his brother Isaack living in Gorcum on behalf of Laurens van Otteren on 11 February 1638 (NA 422. fol. 84).","Inventaris van de contanten, coopmanschappen, ende meubelen ende imboel, bevonden op te sterffdach ende ten huijse van Abraham de Marees den Ouden, beschreven door mij notaris ... ter requisitie ende overstaen van de samentl[ycke]  kinderen erffgenamen van den selven overleden, sijnde de selve bevonden als volcht. Op ten xxvii maij anno 1632 de schilderijen getaxeert door Francois Venant overman vant schilders gilde"
221,270,Gemeentearchief Amsterdam,WK 5073/962,Orphan Chamber,1637/09/30,Maerlen,Amsterdam,115,Nederland,3954 |d  2 st.,41755 |d  4 st.,1577 |d 1637/08/07  |n Maerlen; ?  |d  1637/08/12  |n Geels,1598/12/19,Pui,married to Maria van Geels (Ghils),"Maerlen, Johan van",B,Daniel Jansz. van Beuningen,"Artisan |a Goldsmith, jeweler",auction sale for the benefit of owners' orphan heirs,,Inde Nieuwe Hoogstraet in Amsterdam,"Hans (Jan, Johannes) van Maerle (Merlen, Marel), goldsmith, from Breda, lived on the Nieuwen Dijk in 1598 and in the Nieuwe Hoochstraat for the rest of his life, died on 7 August 1637, when he was 60 years old (De Navorscher 84(1935), p. 41). On 19 December 1598, Hans van Meerle was betrothed to Maria Sijbrechts van Ghils (or Ghilsen), from Breda, living in Breda (DTB 562a/115). She died on 12 August 1637 (De Navorscher, op. cit. p. 39).  In 1631, Jan van Maerle, jeweler, living on the South side of the Nieuwe Hooghstraet, paid a tax of 135 f. (Kohier, fol. 220, p. 50). On 2 September 1636, Carel van der Wijen (probably the brother of Jacques van der Wijen of R 21322), merchant, 52, declared at the request of Jan van Maerle, also merchant, that last August 18, around 2 P.M. he had gone to the beurse and, at the request of Van Maerle, they had bone gone to the house of Guillame Bartolotti regarding a claim of 9,000 f. that Van Maerle had on Bartolotti. It was agreed that Bartolotti would pay 9,000 f. in installments, the first, next morning, amounting to 2,000 f. (NA 991, fol.11, Not. J. Bosch). Emanuel van Surck seems to have been the son of Anthonio Jaspersz. van Surck (of INVNO 541) either from his first marriage with Maria Thibaut, in which case he was already of majority age in 1621, or  from his second marriage with Jacqueline Boudewijns, in which case he could not have been more than about 18 years old at this time, since this second marriage took place in 1617.   Among the buyers of jewelry at the 30 September sale: Lucas van Voorst to Utrecht  (borg: Gerrit van Rijssen), Adriaen ter Haer (borg: David ter Haer), Evert Bochholt, bij David ter Haer (borg: David ter Haer), Jacques Marsier, op de Burchwal bij 't boshuis in de 3 baerties (borg: Isaack van den Ende), David ter Haer (borg: Jochem van Vickevoort), Marike (Maria) van Maerlen (borg: Gerrit van Rijssen), Gerrit van Rijssen (borg: d'swager, Hans van Solt II), Temas de Kemel op Brestraet (borg: Gerrit van Rijssen), Hans Sipel in de Nes goutsmith, (borge: David ter Haer, Pieter ter Haer), Jan Arentsz. lakencooper op de Nimart (borg: Pieter ter Haer), Anthoni Lambertsz., goutsmit in de St. Annadwarsstraet (borg: Nicolaes Lambertsz in de Warmoesstraet, goutsmit), Johannes de Ril Jaeme (Renialme), op de Fluwele Burchwal naest Hendrick Broen (no borg), Mattheus Millert in den Haag, goldsmith (borge: David ter Haer, Hans Sipel), Jacob Pietersz. juwelier op de Keysersgracht naest de akademi (borg: Gerrit van Rijssel), Adriaen van Breen, juwelier (borg: David ter Haer), Willem Sicx (over Albertus Coenradis), Isack van den Ende bij 't Spinhuis (borge: Pieter and David ter Haer), Samuel Reyniersz. op de Negelantoersgracht in no. 9 (borge:Joost van Beeck and David [ter Haer]), Joost van Beeck op de Voorburgwal bij de Verckesluijs (borge: David and Pieter ter Haer), Jan la Toor (Hans le Thoor), bij Jan Jansz. Uijl, schilder (borge: Gerrit van Rijssel and Hans van Solt), Abraham Masurado portugees (borge: Diego Ferdinande Paes and Hans van Solt), Cornelis Spruijt achter de Beurs op 't Rockin (borge: Pieter Leimans and David ter Haer), Pieter Leimants in de [...]straet in de 3 diamanten (borge: Cornelis Spruijt and Joost Verbeeck). At the 3 November 1637 sale of gold and pearls: Nels Rosuwel, goutsmit in de Halsteegh (borg:Albert ter Haer), Hendrick Verstraten op de Singel int Moortgen by de Raembrugh (borg: Gerrit van Rijssel), Andries Gillisz. tot Middelburgh (borg: David ter Haer), Anthonij Verdijen tot Delft (borg: David ter Haer). Gerrit van Rijssel was married to Agatha van Maerle, Jan van Maerle's daughter. Many of these buyers of jewelry also bought works of art (see under the appropriate BYFAM's). Joost  van Beck II, the son of Joost van Beeck I, from Aachen, together with his brother Abraham, inherited the Moscovy operations of Gillis Hooftman(I). They married two sisters, Anna and Maria Hooftman, daughters of Gillis Hooftman and Maria Messing (Wijnroks, Handel tussen Rusland en de Nederlanden, 1560-1640, p. 247). See also the TEXT to R 81.",Den 30 september 1637 zijn dese naervolgende  juweelen ende gesteente vercocht naergelaten bij Jan van Maerle ende Maria van Geels ...Die gheen die in dese venditie iet comt te coopen sal  gehouden sijn te stellen suffisante borghen under renuntiatie tott genoegenen van de vendu meester mits alsdan genietende den tijt van zes weecken ende die geen borgen en stelt sal gehouden sijn contant te betalen ende daervoor borgh gebleven is sal moeten borge voor al [indistinctly overwritten].  Den 27 October 1637 zijn ten versoecke vande erffgenamen van Jan van Maerlen vercocht de goederen bijden voorn. Van Maerlen achtergelaten ende op de selfde conditien als de voorgaende goederen vercocht. Den 3en november 1637 [sale of pearls and gold].
223,1500,Gemeentearchief Amsterdam,WK 5073/962,Orphan Chamber,1637/09/10,Bas,Amsterdam,28,Nederland,583 |d  10 stuivers,,1607 |d 1636,11/08/1630,,,"Bas, Nicolaes",M,Daniel Jansz. van Beuningen,,auction sale,Reformed/Remonstrant,,"This inventory in part overlaps with INVNO 150. For bio-data on Nicholaes Bas, see the TEXT of R 66.",
